Labels	Remarks	Name	Keywords	etc.

Landelijk - Europa - Bestuur - Zuidelijke Nederlanden		Raad van State te Brussel	Raat van State te Brussel	Raat van State tot Brussel	Brussel	Spaansche Nederlanden	Raat van State van dat Gouvernement	Spaansche Nederlanden	Bruxelles
Landelijk - Europa - Bestuur		Raad van State van Engeland	Raat van State in Engelant	Engelant	Raat van State van Engelant
Landelijk - Europa - Bestuur		Raad van State van Frankrijk	Koning van Vrankryk	Vrankrijk	France

Republiek - Financiën - Landelijk - Generaliteit		Generaliteitsrekenkamer	Generaliteyts	Generaliteyt	Generaliteyts Rekenkamer	Generaliteyts Reeken Kamer	Generaliteyts Reeken	Generaliteyts Reekenkaamer

		geen_rvs	Magistraat	Burgermeesters	Burgermeesteren	Raden van de Staten
		ongeldig	deeser Provincie Finances	deezer Provincie Finances	deeser Provincie	deezer Provincie
