Labels	Remarks	Name	Keywords	etc.


Bestuur - Regionaal - Europa		Stenden van Oostfriesland	Stenden van Oostvrieslant	Stenden des Graaffschaps Oostvrieslant	Lantstenden van Oostvrieslant	Stenden van het Graaffschap van Oostvrieslant	Stenden der Graaffschap van Oostvrieslant
Bestuur - Regionaal - Landelijk - Europa		Stenden van Bohemen	Stenden van Bohemien
Bestuur - Regionaal - Republiek		Stenden van de drie Landen van Overmaze	Stenden der drie Landen van Overmaze	Stenden van de drie Landen van Overmaze	Stenden der Landen van Overmaze
Bestuur - Landelijk - Europa		Gouvernement van de Zuidelijke Nederlanden	Generaal Gouvernement der Spaansche Nederlanden	Gouvernement der Oostenryksche Nederlanden	Gouvernement Generaal der Oostenryksche Nederlanden	Gouvernement van de Oostenryksche Nederlanden	Gouvernement te Brussel	Gouvernement Generaal van de Oostenryksche Nederlanden	Gouvernement Generaal	Regeering in de Spaansche Nederlanden	Regeering van de Spaansche Nederlanden	Gouvernement van de Spaansche Nederlanden	Gouvernement van Brussel	Regeering te Brussel

Bestuurlijk - Regionaal - Europa - Zuidelijke Nederlanden		Regering van Luik	Regeering van Luik	Keyserlyke Regeering te Luik	Keyserlyke Regeering tot Luik

Bestuur - Wereld - Koloniaal		Hoge Regering te Batavia	Hooge Regeering
Bestuur - Wereld - Koloniaal		Hoge Regering in Brazilië	Regeering in Brasil	Hooge Regeering in Brasil

Bestuur - Europa - Regionaal - Landelijk	Protestantse Kantons in Zwitserland	Protestantsche Cantons in Switzerlant	Evangelische Cantons in Switzerlant	Protestantsche Cantons in Switserlant

Bestuur - Regionaal - Europa - Wereld		Regering van Algiers	Regeering van Algiers	Dey en Regeering van Algiers	Regeering tot Algiers	Gouvernement van Algiers	Gouvernement te Algiers
Bestuur - Regionaal - Europa - Wereld		Regering van Tripoli	Regeering van Tripoli
Bestuur - Regionaal - Europa - Wereld		Regering van Tunis	Regeering van Tunis

