resolution_id	date	paragraph_id	text	iiif_url
session-1672-02-12-num-1-attendance_list	1672-02-12	session-1672-02-12-num-1-para-1	Veneris den 12. Februarij 1672	https://images.diginfra.net/iiif/NL-HaNA_1.01.02/3285/NL-HaNA_1.01.02_3285_0265.jpg/2609,337,2446,3576/full/0/default.jpg
session-1672-02-12-num-1-attendance_list	1672-02-12	session-1672-02-12-num-1-para-2	Preside den Heere van Coeverden	https://images.diginfra.net/iiif/NL-HaNA_1.01.02/3285/NL-HaNA_1.01.02_3285_0265.jpg/2609,337,2446,3576/full/0/default.jpg
session-1672-02-12-num-1-attendance_list	1672-02-12	session-1672-02-12-num-1-para-3	Præsentibus de Heeren van Gendt, Gellicum, Brakell, Vijgh, Ripperda tot Buirse Schimmelpenningh, Ommeren Werckendam, Goeree, Meerens Odijck, Reijgersbergh, Crommon, Vrijbergen, Mauregnault,	https://images.diginfra.net/iiif/NL-HaNA_1.01.02/3285/NL-HaNA_1.01.02_3285_0265.jpg/2609,337,2446,3576/full/0/default.jpg
session-1672-02-12-num-1-attendance_list	1672-02-12	session-1672-02-12-num-1-para-4	Schade, vander Hoolck, met een Extraord Gedep. van Utrecht Isbrandt van Vierssen, Bouritius, Arnould van Vierssen, Ter Borgh, Gockinga.	https://images.diginfra.net/iiif/NL-HaNA_1.01.02/3285/NL-HaNA_1.01.02_3285_0265.jpg/2609,337,2446,3576/full/0/default.jpg
session-1672-02-12-num-1-attendance_list	1672-02-12	session-1672-02-12-num-1-para-5	De resolutien gisteren genomen, sijn gelesen ende geresumeert, gelijck oock geresumeert, ende gearresteert sijn de depesches daeruijt resulterende.	https://images.diginfra.net/iiif/NL-HaNA_1.01.02/3285/NL-HaNA_1.01.02_3285_0265.jpg/2609,337,2446,3576/full/0/default.jpg
session-1672-02-12-num-1-resolution-1	1672-02-12	session-1672-02-12-num-1-para-6	Ontfangen een Missive vande Ridderschap ende steeden, de Staten van Overijssel, geschreven tot Deventer, den achtsten December 1671. stilo loci, daer bij deselve aen hare Ho:Mo: voordragen de persoon vanden heere Dirck Ludolph van Keppel tot Champherbeeck, omme in plaetse vande heer die laetst uijt het quartier van vollenho, deselve Commissie heeft becleet, te resideren in des Generaliteijts reeckencamer. waerop gedelibereert sijnde, Is den gemeltenheer Ludolph van Keppel gehouden voor gecommitteert, ende vervolgens naer gedaenen eedt, door den heer Ter Bergh, inde gemelte reeckensamer geintroduceert.	https://images.diginfra.net/iiif/NL-HaNA_1.01.02/3285/NL-HaNA_1.01.02_3285_0265.jpg/2609,337,2446,3576/full/0/default.jpg
session-1672-02-12-num-1-resolution-2	1672-02-12	session-1672-02-12-num-1-para-7	Ontfangen een Missive vande heeren Staten van hollandt ende Westvrieslandt, geschreven alhier inden Hage den elffden deser, daerbij deselve aen haer Ho:Mo: voordragen de persoon van Dirck Spiegel, oudt schepen der Stadt amsterdam, om te resideren in het Collegie ter admiraliteijt in Westvrieslandt, ende den Noorderquartiere, in plaetse van Nicolaes — van Opmeer, schepen der selver Stadt: waerop gedelibereert sijnde, Is goetgevonden ende verstaen, dat Commissie in gewoonlijcke forme, voor, ende ten behoeve vanden gemelten heer Spiegel gedepescheert sal - werden, doende daerop den behoorlijcken Eedt, die hij noch staende vergaderinge heeft afgelecht.	https://images.diginfra.net/iiif/NL-HaNA_1.01.02/3285/NL-HaNA_1.01.02_3285_0265.jpg/2609,337,2446,3576/full/0/default.jpg, https://images.diginfra.net/iiif/NL-HaNA_1.01.02/3285/NL-HaNA_1.01.02_3285_0266.jpg/783,-17,1893,3913/full/0/default.jpg
session-1672-02-12-num-1-resolution-2	1672-02-12	session-1672-02-12-num-1-para-8	Is ter vergaderinge gelesen het memoriael vande aenwesende heeren Gecommitteerden uijt de respective Collegien ter admiraliteijt in hollandt residerende, geformeert alhier inden hage den twaelffden Januarij laestleden, raeckende de bewuste Equipagie vanden voorleden Jaere 1671. het formeren vande reeckeninge van deselve, het depescheren vande ordonnantien der consenten inden Jaere 1667. ende 1668. bijde heeren Staten vande respective provincien tot de equipages daenmaels gedaen, gedragen, midtsgaders — het arresteren vande Extraordinaris equipagie voor desen loopenden Jaere, ende het aennemen van thien duijsent Bootsgesellen, soo als het voorschreve memoriael hiernaer van woorde te woorde Staet geinsereert	https://images.diginfra.net/iiif/NL-HaNA_1.01.02/3285/NL-HaNA_1.01.02_3285_0266.jpg/783,-17,1893,3913/full/0/default.jpg
session-1672-02-12-num-1-resolution-2	1672-02-12	session-1672-02-12-num-1-para-9	Hoogh Mogende heeren	https://images.diginfra.net/iiif/NL-HaNA_1.01.02/3285/NL-HaNA_1.01.02_3285_0266.jpg/783,-17,1893,3913/full/0/default.jpg
session-1672-02-12-num-1-resolution-2	1672-02-12	session-1672-02-12-num-1-para-10	De ondergeschreve Gecommitteerden uijt de Collegien ter admiraliteijt, residerende in hollandt, ende Westvrieslandt, hebben van haer devoir geachte U ho:Mo: met behoorlijck respect, te representeren, hoe dat doorde heeren hare committenten sijn geequipeert compleet in Zee gebracht, ende behoorlijck onderhouden alle de schepen van oorloge ende t'geene daeraen was dependerende voor soo veel haer contingent inde Extraordinaris Equipagie, door U Ho:Mo: voorden Jaere 1671. geordonneert, was bedragende, ende hadden dienvolgende billick — verwacht, dat de middelen vande subsidien, door U Ho:Mo: tot de voorschreve equipagie geconsenteert, aende voorschreve Collegien ter admiraliteijt promptelijck souden sijn gefourneert geworden, omme daermede de lasten vande voorschreve equipagie te connen voldoen. Ende dewijle de heeren Staten van hollandt, ende Westvrieslandt, nu wede„ romme hebben gefourneert, ofte bereijt sijn ten Comptoire van U Ho:Mo: ontfanger generael te betalen eene somme van ses hondert duijsent guldens, ten einde die aende Collegien ter admiraliteijt mochte werden uijtgekeert, omme daermede, ofte soo — verre, als het sal connen strecken, de gemaeckte schulden over de voorschreve equipagie te betalen, ende alsoo daerdoor bequaem te werden gemaeckt, omme in conformité van ho:Mo: resolutie vanden sesten aprill lestleden, ter generaliteijts reeckencamer vande voorschreve Extraordinaris Equipagie behoorlijck te connen verreeckenen, want nademael de meergedachte reeckenCamer haer niet en bevindt gequalificeert, omme eenige Staten, ende begrotinge van lasten der voorschreve equipagie aen te nemen, soo gelieven U Ho:Mo: te considereren, dat het voor de welgemelte Collegien ter admiraliteijt, is een absolutie onmogelijckheijt omme over te brengen pertinente reeckeninge geverifieert met de documenten daertoe applicabel, omme ter Generaliteijts reecken Camer, volgens ordre van desen Lande, opgenomen, ende geslooten te connen werden, ten sij dat de lasten vande voorschreve equipagie, alvooren effective sullen wesen voldaen. De voorschreve ses hondert duijsent guldens, wesende ontfangen, ende aende Crediteuren uijtgekeert, soo sullen de welgemelte Collegien ter admiraliteijt, daerdoor werden bequaem gemaeckt, omme de reeckeninge vande voorschreve Extraordinaris Equipagie, met de documenten daertoe gerequireert ten burele over te leveren, ende indien bij het opnemen ende sluijten van soodanige reeckeninge mochte werden ondervonden dat de geconsenteerde ende betaelde subsidien, met behoorlijck ende alleen tot de voorschreve Extraordinaris equipagie sijn bekeert, ofte dat de lasten vande voorschreve equipagie, minder als de subsidien mochten comen te bedragen, daer nochtans de voorschreve Gecommitteerden haer van het contrarie houden versekert: soo can alsdan aen soodanigh Collegie ter admiraliteijt het overschot vande ontfangen penningen opde volgende equipagie werden geimputeert. Waeromme dan U Ho:Mo: seer ernstigh werden versocht, de heeren raeden van State te authoriseeren, omme sonder langer uijtstell, ordonnantie vande voorschreve ses hondert duijsent guldens ten behoeve vande meergemelte Collegien ter admiraliteijt te depescheren, ten einde de voorschreve ses hondert duijsent guldens, eenmael machtigh connen werden.	https://images.diginfra.net/iiif/NL-HaNA_1.01.02/3285/NL-HaNA_1.01.02_3285_0266.jpg/783,-17,1893,3913/full/0/default.jpg, https://images.diginfra.net/iiif/NL-HaNA_1.01.02/3285/NL-HaNA_1.01.02_3285_0266.jpg/3262,-35,1785,3940/full/0/default.jpg, https://images.diginfra.net/iiif/NL-HaNA_1.01.02/3285/NL-HaNA_1.01.02_3285_0267.jpg/710,-29,1925,3980/full/0/default.jpg
session-1672-02-12-num-1-resolution-2	1672-02-12	session-1672-02-12-num-1-para-11	Ho:Mo: werden mede versocht, ende gere„ commandeert, omme eenmael te disponeren opde augmentatie van costgelden, door de hooftofficieren, ende Capiteijnen, die inde voorschreve Extraordinaris Equipage sijn geemploijeert geweest, versocht, ten einde de Collegien ter admiraliteijt mogen weten hoedanigh de reeckeninge vande costgelden der voorschreve officieren, sullen opmaecken, ende sluijten.	https://images.diginfra.net/iiif/NL-HaNA_1.01.02/3285/NL-HaNA_1.01.02_3285_0267.jpg/710,-29,1925,3980/full/0/default.jpg
session-1672-02-12-num-1-resolution-2	1672-02-12	session-1672-02-12-num-1-para-12	Bij verscheijde memorien, ende remonstrantien ende noch jonghst opden seventhienden februarij, ende negenden December des voorleden Jaars, soo is aen U Ho:Mo: geremonstreert, dat de Collegien ter admirlt. vande heeren Raeden van State geene ordonnantien en weten te becomen vande consenten door U Ho:Mo: gedragen tot de extraordinaris equipagie ter Zee, over de Jaren 1667. ende 1668. soo versoecken de voorschreve Gecommitteerden dat U Ho: Mo: eenmael soodanige prompte ordre gelieven te stellen, dat de voorschreve ordonnantien doorden meer gedachten raede van State mogen werden gedepescheert, ende de Collegien ter admiraliteijt ter handen gestelt.	https://images.diginfra.net/iiif/NL-HaNA_1.01.02/3285/NL-HaNA_1.01.02_3285_0267.jpg/710,-29,1925,3980/full/0/default.jpg, https://images.diginfra.net/iiif/NL-HaNA_1.01.02/3285/NL-HaNA_1.01.02_3285_0267.jpg/3200,-4,1796,3933/full/0/default.jpg
session-1672-02-12-num-1-resolution-2	1672-02-12	session-1672-02-12-num-1-para-13	Eijndelijck soo hebben de voornoemde Gecom„ mitteerden haer verplicht gevonden, U Ho:Mo: met behoorlijck respect te representeren, ende niettemin gedienstigh te versoecken, dat U Ho: Mo: bij dese becommerlijcke constitutie van tijden, ende saecken, eenmael gelieven te concluderen ende vast te stellen, de equipagie voorden tegenwoordigen Jaere, alsmede sonder uijtstell te arresteren die wervinge der matrosen, alsoo te gemoet wert gesien, dat bij langer uijtstel van soodanige wervinge, veele vande bequaemste, oude, ervarentste matrosen, buijten den Staet van U Ho:Mo: sullen vertrecken, ende haer in andere diensten begeven, t'welck groot retardement, ende prejuditie aen U Ho:Mo: equipagie sal comen te veroorsaecken. Ende nademael bij het concept vande voorschreve equipagie is ter neder gestelt, dat thien duijsent matrosen souden werden aengenomen die ses stuijvers s'daechs, tot halff meert toecomende, voor soldije souden genieten, doch den tijt tegenwoordigh soo verre wesende geavanceert, dat het alsnu is buijten apparentie, op die voet bevare matroosen haer in dienst vanden Lande sullen willen begeven; soo oordeelen de voornoemde Gecommitteerden (onder correctie) dienstigh ende nootsaeckelijck te wesen, omme het bootsvolck tot den dienst van U Ho:Mo: te animeren, dat henluijden werde belooft ende toegestaen, dat hare soldijen sullen ingaen, met den dagh, dat haer in U Ho:Mo: dienst laten enrolleren: op alle t'welcke U Ho:Mo: spoedige dispositie wert versocht, op dat de Collegien ter admiraliteijt mogen weten waernaer haer in desen te reguleren. Aldus geadviseert ende overgegeven opden twaelff den Januarij 1672. was geteeckent W. V. Wassenaar, A. van Beresteijn D van Lodensteijn, C. D. Boetselaar, Isb: Schaffen, Nicol, Tangs, R. de Wedt, Henrick Huijgh, Wilhelm van Neck,	https://images.diginfra.net/iiif/NL-HaNA_1.01.02/3285/NL-HaNA_1.01.02_3285_0267.jpg/3200,-4,1796,3933/full/0/default.jpg, https://images.diginfra.net/iiif/NL-HaNA_1.01.02/3285/NL-HaNA_1.01.02_3285_0268.jpg/772,-6,1869,3932/full/0/default.jpg
session-1672-02-12-num-1-resolution-2	1672-02-12	session-1672-02-12-num-1-para-14	Waerop gedelibereert sijnde, Is goetgevonden, ende verstaen, dat het voorschreve memoriael gestelt sal werden in handen vande heeren Schimmelpenningh, ende andere haere Ho:Mo: Gedeputeerden tot de saecken vande Zee, om te visiteren, examineren, ende daervan rapport te doen.	https://images.diginfra.net/iiif/NL-HaNA_1.01.02/3285/NL-HaNA_1.01.02_3285_0268.jpg/772,-6,1869,3932/full/0/default.jpg
session-1672-02-12-num-1-resolution-2	1672-02-12	session-1672-02-12-num-1-para-15	De declaratie van Dirck Arentsz Ball, stierman van Scheveninge, met sijn princke ende volck den derden deser naer Engelandt, overdre van haer Ho:Mo: overgevoert hebbende, den postmeester Johan van Steijgert, Is naer voorgaende deliberatie goetgevonden, ende verstaen, dat gesonden sal werden aendenraadt van State, ende generaliteijts Reecken„ ,,camer, omme te visiteren, examineren, ende liquideren, volgens, ende in conformité vande ordres vant' Landt.	https://images.diginfra.net/iiif/NL-HaNA_1.01.02/3285/NL-HaNA_1.01.02_3285_0268.jpg/772,-6,1869,3932/full/0/default.jpg
session-1672-02-12-num-1-resolution-3	1672-02-12	session-1672-02-12-num-1-para-16	Ontfangen een Missive van het Collegie ter admiraliteijt tot Amsterdam, geschreven aldaer den thienden deses, raeckende der selver contingent inde Extraordinaris Equipagie inden voorleden Jaere 1671. geconsenteert, midtsgaders het formeren vande reeckeninge van de selve Equipagie, ende versoeckende ten minsten bij provisie te mogen ontfangen, de helft van ses hondert duijsent guldens, ten Comptoire vanden Ontfanger Generael van Volbergen, soo sij bericht sijn, door deheeren Staten van hollandt en Westvrieslandt, in voldoeninge van der selver quote inde voorschreve Extraordinaris equipagie gefurneert: Waerop gedelibereert sijnde, Is goetgevonden ende verstaen, dat de voorschreve missive gestelt sal worden in handen vande heeren Schimmelpenningh, ende andere hare Ho:Mo: Gedeputeerden tot de saecken vande Zee, met ende nevens eenige heeren Gecommitteerden in des generaliteijts reeckenkamer, om te visiteren, examineren, ende daervan rapport te doen.	https://images.diginfra.net/iiif/NL-HaNA_1.01.02/3285/NL-HaNA_1.01.02_3285_0268.jpg/772,-6,1869,3932/full/0/default.jpg, https://images.diginfra.net/iiif/NL-HaNA_1.01.02/3285/NL-HaNA_1.01.02_3285_0268.jpg/3001,-23,2009,3888/full/0/default.jpg
session-1672-02-12-num-1-resolution-3	1672-02-12	session-1672-02-12-num-1-para-17	Is ter vergaderinge gelesen de requeste vande gesamentlijcke beden vande Generaliteijt, raeckende het doen vande reijsen van deselveboden, ende de postmeesters van haer Ho:Mo: midtsgaders het reglement van deselve reijsen soo als de voorschreve requeste hier naer van woorde te woorde staet geinsereert	https://images.diginfra.net/iiif/NL-HaNA_1.01.02/3285/NL-HaNA_1.01.02_3285_0268.jpg/3001,-23,2009,3888/full/0/default.jpg
session-1672-02-12-num-1-resolution-3	1672-02-12	session-1672-02-12-num-1-para-18	ende Hoogh Mogende Heeren Staten Generael der Vereenichde Nederlanden,	https://images.diginfra.net/iiif/NL-HaNA_1.01.02/3285/NL-HaNA_1.01.02_3285_0268.jpg/3001,-23,2009,3888/full/0/default.jpg
session-1672-02-12-num-1-resolution-3	1672-02-12	session-1672-02-12-num-1-para-19	Geven met alle onderdanicheijt te kennen, de gesamentlijcke Boden vande generaliteijt, U Ho:Mo: onderdanichste Dienaren, hoe dat van haer Supplianten dagelijcx thien boden volgens t'reglement moeten oppassen, en oversulcx oock sware diensten subject sijn te doen, evenwel hoe langer hoe ameer haerboden ampt door de postmeesters van U. Ho: Mo: wort ondercrapen, voornamentlijck doorden postmeester Steggerd, dewelcke de reijsen naer Eijgelandt, ende andere reijsen, die te water moeten gedaen worden, ende voor desen continuelijcken door de boden altijt gedaen — geweest, warden vervreemt. Ende alsoo - u ho:Mo: een reglement hebben gelieven te beramen, waerin de posten, ende booden reijsen worden onderscheijden, in welcke wort vermelt, wat reijsen de posten, en oock deboden souden mogen toecomen, uijtgesondert de voorschreve Engelsche reijsen, ende mede de reijsen naer Brussel, ende Vranckrijck, welcke laeste inden tijt van Oorloge tusschen uwe Ho:Mo:, ende den heer Coningh van Spaigne, mede altijt te water door de Boden sijn gedaen geworden, waeromme dickwils groote disputen tusschen de voorschreve postmeesters ende de Supplianten comen te vallen; versoecken daeromme de Supplianten, dat u ho:Mo: soodanigen voornoemde reijsen, dewelcke naer desen souden mogen voorvallen, door de Supplianten mochten werden gedaen, twelck doende ??	https://images.diginfra.net/iiif/NL-HaNA_1.01.02/3285/NL-HaNA_1.01.02_3285_0268.jpg/3001,-23,2009,3888/full/0/default.jpg, https://images.diginfra.net/iiif/NL-HaNA_1.01.02/3285/NL-HaNA_1.01.02_3285_0269.jpg/787,-42,1844,3970/full/0/default.jpg
session-1672-02-12-num-1-resolution-3	1672-02-12	session-1672-02-12-num-1-para-20	Waerop geen resolutie en is gevallen.	https://images.diginfra.net/iiif/NL-HaNA_1.01.02/3285/NL-HaNA_1.01.02_3285_0269.jpg/787,-42,1844,3970/full/0/default.jpg
session-1672-02-12-num-1-resolution-3	1672-02-12	session-1672-02-12-num-1-para-21	Ontfangen twee missiven vanden resident hamel Bruijnincx, geschreven tot Weenen den een en dertichsten Januarij lestleden, — een daervan geaddresseert aenden Griffier, houdende advertentie, ende daernevens een — bijlage: Waerop geen resolutie en is gevallen.	https://images.diginfra.net/iiif/NL-HaNA_1.01.02/3285/NL-HaNA_1.01.02_3285_0269.jpg/787,-42,1844,3970/full/0/default.jpg
session-1672-02-12-num-1-resolution-4	1672-02-12	session-1672-02-12-num-1-para-22	Ontfangen een missive vanden heere Churfurst van Brandenburch, geschreven tot Coln ander princ, den vierentwintichsten Januarij - laestleden, stilo loci, houdende advertentie, dat sijne Churfurstelijcke Doorluchticheijt van meijninge was, den doop vanden jongh gebooren Prince te doen celebreren den vierden februarij naestcomende, stilo - loci, ende versoeckende dat hare Ho:Mo: daervan getuijgen soude willen sijn, Noch ontfangen een Missive vandenheer van Amerongen, haer Ho:Mo: extrs Gedeputeerde aenden hoochgemelten heere Churfurst, geschreven tot Cöln aender Spree voornoemt den derden deser, geaddresseert aenden Griffier, t' voorschreve subject mede concernerende Waerop gedelibereert sijnde, Is goetgevonden ende verstaen, dat de — voorschreve Missive gestelt sal werden in handen vande heeren van Ommeren, ende andere hare Ho:Mo: Gedeputeerden tot de saecken vande finantie, om te visiteren, examineren, de retroacta op gelijck subject applicabel naer te sien. ende van alles rapport te doen: sonder resumptie.	https://images.diginfra.net/iiif/NL-HaNA_1.01.02/3285/NL-HaNA_1.01.02_3285_0269.jpg/787,-42,1844,3970/full/0/default.jpg
session-1672-02-12-num-1-resolution-5	1672-02-12	session-1672-02-12-num-1-para-23	Ontfangen een missive vanden Raedt van State, geschreven alhier inden Hage den elffden deses, houdende ingevolge — ende tot voldoeninge van haer Ho:Mo: resolutie vanden achtentwintichsten Januarij 12. Februarij. 12. Februarij.	https://images.diginfra.net/iiif/NL-HaNA_1.01.02/3285/NL-HaNA_1.01.02_3285_0269.jpg/787,-42,1844,3970/full/0/default.jpg, https://images.diginfra.net/iiif/NL-HaNA_1.01.02/3285/NL-HaNA_1.01.02_3285_0269.jpg/2635,-17,2388,3946/full/0/default.jpg
session-1672-02-12-num-1-resolution-5	1672-02-12	session-1672-02-12-num-1-para-24	Preside den Heere van Coeverden:	https://images.diginfra.net/iiif/NL-HaNA_1.01.02/3285/NL-HaNA_1.01.02_3285_0269.jpg/2635,-17,2388,3946/full/0/default.jpg
session-1672-02-12-num-1-resolution-5	1672-02-12	session-1672-02-12-num-1-para-25	Præsentibus de Heeren van Gendt, Gellicum Braeckel, Vijgh, Ripperda tot Buirse, Schimmelpenningh, Ommeren,	https://images.diginfra.net/iiif/NL-HaNA_1.01.02/3285/NL-HaNA_1.01.02_3285_0269.jpg/2635,-17,2388,3946/full/0/default.jpg
session-1672-02-12-num-1-resolution-5	1672-02-12	session-1672-02-12-num-1-para-26	Werckendam, Asperen, Goeree, Voorburgh, Meerens, Odijck, Pieterszon, Crommon, Vrijbergen, Mauregnault Schade, vander Hoolck, met een Extrs Gedepden. van Utrecht, Isbrandt van Vierssen, Bouritius, Arnould van Vierssen, Ter Borgh,	https://images.diginfra.net/iiif/NL-HaNA_1.01.02/3285/NL-HaNA_1.01.02_3285_0269.jpg/2635,-17,2388,3946/full/0/default.jpg
session-1672-02-12-num-1-resolution-5	1672-02-12	session-1672-02-12-num-1-para-27	Gockinga. laestleden, der selver consideratien, - ende advijs op het doen van eene meerdere equipagie te water, midtsgaders wervinge te Lande, ende daernevens twee bijlagen; Waerop - gedelibereert sijnde, Is goetgevonden ende verstaen, dat de voorschreve Missive ende bijlagen gestelt sullen werden in handen vande heeren Ripperda tot Buirse, ende andere haer Ho:Mo: Gedeputeerden tot de militaire saecken, met ende nevens eenige heeren Gecommitteerden uijt den Raedt van State bij haer E. selfs te nomineren, omme te visiteren, examineren, ende daervan rapport te doen.	https://images.diginfra.net/iiif/NL-HaNA_1.01.02/3285/NL-HaNA_1.01.02_3285_0269.jpg/2635,-17,2388,3946/full/0/default.jpg
session-1672-02-12-num-1-resolution-5	1672-02-12	session-1672-02-12-num-1-para-28	Sabbathi den 13en. Februarij 1672	https://images.diginfra.net/iiif/NL-HaNA_1.01.02/3285/NL-HaNA_1.01.02_3285_0269.jpg/2635,-17,2388,3946/full/0/default.jpg
session-1672-02-12-num-1-resolution-5	1672-02-12	session-1672-02-12-num-1-para-29	De resolutien gisteren genomen, sijn gelesen, ende geresumeert, gelijck oock geresumeert ende gearresteert sijn de depesches daeruijt resulterende.	https://images.diginfra.net/iiif/NL-HaNA_1.01.02/3285/NL-HaNA_1.01.02_3285_0269.jpg/2635,-17,2388,3946/full/0/default.jpg
session-1672-02-12-num-1-resolution-6	1672-02-12	session-1672-02-12-num-1-para-30	Ontfangen een Missive vande heeren Staten van hollandt ende Westvrieslandt, geschreven alhier inden Hage, den elffden deser, daerbij deselve aen haer Ho:Mo: voordragen den persoon van Mr. Johan vander Dussen, raedt ende aedt Schepen der Stadt Delft, omme te resideren in het Collegie ter admiraliteijt tot Rotterdam in plaetse van Mr. Nicolaes van Beresteijn, ende raadt ende oudt schepen der selverstadt; Waerop gedelibereert sijnde, Is goetgevonden ende verstaen, dat Commissie in gewoonlijcke forme voor, ende ten behoeve vanden voornoemden heere vander Dussen gedepescheert sal werden, doende daerop den behoorlijcken eedt, die hij noch staende vergaderinge heeft affgeleijt,	https://images.diginfra.net/iiif/NL-HaNA_1.01.02/3285/NL-HaNA_1.01.02_3285_0269.jpg/2635,-17,2388,3946/full/0/default.jpg, https://images.diginfra.net/iiif/NL-HaNA_1.01.02/3285/NL-HaNA_1.01.02_3285_0270.jpg/803,-21,1867,3933/full/0/default.jpg
session-1672-02-12-num-1-resolution-6	1672-02-12	session-1672-02-12-num-1-para-31	Sijnde ter vergaderinge bekent gemaeckt, dat de ratificatie vanden Coningh van Spaigne ende mutaele belofte van Secours, bijdeheeren van Gent, ende andere hare Ho:Mo: Gedeputeerden tot de saecken vande Triple alliantie, ter eenre, ende den heere Don Manuel Francisco de Lira, Extraordinaris Envoijé vanden hoochstgedachten Coninck ter anderen zijde, den seventhienden December lestleden, gepasseert, hier te Lande gecomen ende den gemelten heere de Lira, Extraen= „donnans Savoije gereet was, om die tegens gelijcke ratificatie van haer Ho: Mo: uijt te wisselen. Is naer voorgaende deliberatie goetgevonden, ende verstaen, dat de uijtwisselinge vande voorschreve ratificatien met den aldereersten gedaen sal werden.	https://images.diginfra.net/iiif/NL-HaNA_1.01.02/3285/NL-HaNA_1.01.02_3285_0270.jpg/803,-21,1867,3933/full/0/default.jpg
session-1672-02-12-num-1-resolution-6	1672-02-12	session-1672-02-12-num-1-para-32	Ontfangen twee missiven vanden resident le Maire, beijde geschreven tot Copenhaven den tweeden ende sesten deser, houdende advertentie: Waerop gedelibereert sijnde, Is goetgevonden ende verstaen, dat de voorschreve Missiven gestelt sullen werden in handen vande heeren Schimmelpenningh, ende andere hare Ho:Mo: Gedeputeerden tot de saecken van Dene„ marcken, om te visiteren, examineren, ende daervan rapport te doen.	https://images.diginfra.net/iiif/NL-HaNA_1.01.02/3285/NL-HaNA_1.01.02_3285_0270.jpg/803,-21,1867,3933/full/0/default.jpg
session-1672-02-12-num-1-resolution-7	1672-02-12	session-1672-02-12-num-1-para-33	Ontfangen een Missive vanden resident Sasburgh, geschreven tot Brussel, den sevenden deses, houdende advertentie: Waerop geen resolutie en is gevallen.	https://images.diginfra.net/iiif/NL-HaNA_1.01.02/3285/NL-HaNA_1.01.02_3285_0270.jpg/803,-21,1867,3933/full/0/default.jpg
session-1672-02-12-num-1-resolution-8	1672-02-12	session-1672-02-12-num-1-para-34	Ontfangen een missive vande heeren de Witt, van Vrijbergen, ende Rhijn Grave, haer Ho: Mo: Extraordinaris Gedeputeerden tot Brussel, geschreven aldaer den sesten deses, houdende advertentie, ende onder anderen dat het ten hoochsten nodigh was, dat ijemandt spoedelijck naer Spaigne soude mogen werden gesonden: Waerop gedelibereert sijnde, Is goetgevonden ende verstaen, dat de voorschreve Missive gesonden sal werden aenden heere van Stevelshoeck haer Ho:Mo: gedesigneerden resident aen het hoff van Spaigne, tot desselfs narichtinge, ende om sijne reijse derwaerts te verspoedigen ende dat wijders deselve missive gestelt sal werden in handen vande heeren Ripperda tot Buirse, ende andere hare Ho:Mo: Gedeputeerden tot de militaire saecken met ende nevens eenige heeren Gecommitteerden uijt den landt van State, bij haer E. selfs te nomineren, om te visiteren, examineren, ende daervan rapport te doen.	https://images.diginfra.net/iiif/NL-HaNA_1.01.02/3285/NL-HaNA_1.01.02_3285_0270.jpg/803,-21,1867,3933/full/0/default.jpg, https://images.diginfra.net/iiif/NL-HaNA_1.01.02/3285/NL-HaNA_1.01.02_3285_0270.jpg/3150,-25,1843,3936/full/0/default.jpg
